{
  "$id": "https://posthog-impact.local/schemas/extraction_runs.schema.json",
  "$schema": "https://json-schema.org/draft/2020-12/schema",
  "additionalProperties": false,
  "properties": {
    "counters": {
      "arrow_type": "null",
      "type": [
        "string",
        "null"
      ]
    },
    "duration_seconds": {
      "arrow_type": "double",
      "type": [
        "number",
        "null"
      ]
    },
    "extractor_version": {
      "arrow_type": "string",
      "type": [
        "string",
        "null"
      ]
    },
    "host": {
      "arrow_type": "string",
      "type": [
        "string",
        "null"
      ]
    },
    "notes": {
      "arrow_type": "list<element: string>",
      "type": [
        "array",
        "null"
      ]
    },
    "pipeline_version": {
      "arrow_type": "string",
      "type": [
        "string",
        "null"
      ]
    },
    "platform": {
      "arrow_type": "string",
      "type": [
        "string",
        "null"
      ]
    },
    "python_version": {
      "arrow_type": "string",
      "type": [
        "string",
        "null"
      ]
    },
    "repository": {
      "arrow_type": "string",
      "type": [
        "string",
        "null"
      ]
    },
    "run_finished_at": {
      "arrow_type": "string",
      "type": [
        "string",
        "null"
      ]
    },
    "run_id": {
      "arrow_type": "string",
      "type": [
        "string",
        "null"
      ]
    },
    "run_started_at": {
      "arrow_type": "string",
      "type": [
        "string",
        "null"
      ]
    },
    "schema_version": {
      "arrow_type": "string",
      "type": [
        "string",
        "null"
      ]
    },
    "stage": {
      "arrow_type": "string",
      "type": [
        "string",
        "null"
      ]
    },
    "status": {
      "arrow_type": "string",
      "type": [
        "string",
        "null"
      ]
    },
    "window_end": {
      "arrow_type": "string",
      "type": [
        "string",
        "null"
      ]
    },
    "window_start": {
      "arrow_type": "string",
      "type": [
        "string",
        "null"
      ]
    }
  },
  "title": "extraction_runs",
  "type": "object",
  "x-pipeline-version": "1.0.0",
  "x-schema-version": "1.0.0"
}
