[
  {
    "counters": {
      "binary_file_records": 8363,
      "clone": {
        "analyzed_head_committed_at": "2026-08-17T02:43:54Z",
        "analyzed_head_sha": "d4295d5794f95a0ae726edd0e27450115f3fc0a3",
        "clone_strategy": "shallow_since",
        "commit_count_available": 15485,
        "default_branch": "master",
        "extractor_version": "1.0.0",
        "fetched_at": "2026-08-17T03:06:29.597786Z",
        "is_shallow": true,
        "linear_history": true,
        "local_path": "/Users/rishsharma/Smart-SWE-Impact-Dashboard/data/raw/git/posthog",
        "oldest_available_commit_at": "2026-08-17T02:43:54Z",
        "parent_count_distribution": {
          "0": 1,
          "1": 15484
        },
        "repository_url": "https://github.com/PostHog/posthog"
      },
      "commit_count": 15485,
      "commit_file_count": 168822,
      "commits_with_co_authors": 5334,
      "commits_with_pr_suffix": 15452,
      "config_snapshots": {
        "missing": 1,
        "missing_paths": [
          ".github/CODEOWNERS-soft"
        ],
        "present": 151
      },
      "extractor_version": "1.0.0",
      "orphan_file_records": 0,
      "rename_records": 6817,
      "reverts": 0
    },
    "duration_seconds": 63.779,
    "extractor_version": "1.0.0",
    "host": "Rishs-MacBook-Air.local",
    "notes": [],
    "pipeline_version": "1.0.0",
    "platform": "Darwin-arm64",
    "python_version": "3.12.1",
    "repository": "github.com/PostHog/posthog",
    "run_finished_at": "2026-08-17T03:07:32.984764Z",
    "run_id": "ce2b8c06e3394c66",
    "run_started_at": "2026-08-17T03:06:29.206193Z",
    "schema_version": "1.0.0",
    "stage": "ingest_git",
    "status": "ok",
    "window_end": "2026-08-17T03:06:27.195469Z",
    "window_start": "2026-05-19T00:00:00Z"
  },
  {
    "counters": {
      "coverage": {
        "analyzed_head_sha": "d4295d5794f95a0ae726edd0e27450115f3fc0a3",
        "computed_at": "2026-08-17T03:22:28.644535Z",
        "dependency_graph_version": "1.0.0",
        "files_with_dynamic_imports": 18,
        "graph_nodes": 36427,
        "hub_fan_in_threshold": 12,
        "internal_edges": 125827,
        "not_parsed_files": 1774,
        "not_parsed_languages": [
          "go",
          "hog",
          "rb",
          "rust",
          "sql"
        ],
        "parse_error_examples": [],
        "parse_errors": 0,
        "python": {
          "by_resolution": {
            "exact": 71925,
            "external": 57153,
            "prefix": 1
          },
          "import_statements": 129079,
          "internal_resolution_rate": 0.557225,
          "resolved_internal": 71926
        },
        "tracked_files": 43948,
        "tsconfig_alias_count": 27,
        "tsconfig_error": null,
        "typescript_javascript": {
          "by_resolution": {
            "alias": 36264,
            "external": 30258,
            "external_alias": 1918,
            "relative": 17637,
            "relative_missing": 10705,
            "unresolved": 4569
          },
          "import_statements": 101351,
          "internal_resolution_rate": 0.531825,
          "resolved_internal": 53901
        }
      },
      "tables": {
        "component_edges": 1572,
        "dependency_edges": 125827,
        "module_nodes": 36427
      }
    },
    "duration_seconds": 184.571,
    "extractor_version": "1.0.0",
    "host": "Rishs-MacBook-Air.local",
    "notes": [],
    "pipeline_version": "1.0.0",
    "platform": "Darwin-arm64",
    "python_version": "3.12.1",
    "repository": "github.com/PostHog/posthog",
    "run_finished_at": "2026-08-17T03:22:28.645158Z",
    "run_id": "ea5f1c5e76b74c81",
    "run_started_at": "2026-08-17T03:19:24.074531Z",
    "schema_version": "1.0.0",
    "stage": "graph",
    "status": "ok",
    "window_end": "2026-08-17T03:19:23.815900Z",
    "window_start": "2026-05-19T00:00:00Z"
  },
  {
    "counters": {
      "coverage": {
        "analyzed_head_sha": "d4295d5794f95a0ae726edd0e27450115f3fc0a3",
        "computed_at": "2026-08-17T03:28:23.765751Z",
        "dependency_graph_version": "1.0.0",
        "files_with_dynamic_imports": 18,
        "graph_nodes": 36412,
        "hub_fan_in_threshold": 13,
        "internal_edges": 130967,
        "not_parsed_files": 1774,
        "not_parsed_languages": [
          "go",
          "hog",
          "rb",
          "rust",
          "sql"
        ],
        "parse_error_examples": [],
        "parse_errors": 0,
        "python": {
          "by_resolution": {
            "exact": 71921,
            "external": 57144,
            "prefix": 2
          },
          "import_statements": 129067,
          "internal_resolution_rate": 0.557253,
          "resolved_internal": 71923
        },
        "tracked_files": 43918,
        "tsconfig_alias_patterns": 61,
        "tsconfig_errors": [],
        "tsconfig_scopes": 15,
        "typescript_javascript": {
          "by_resolution": {
            "alias": 41411,
            "external": 29045,
            "external_alias": 1921,
            "relative": 17633,
            "relative_missing": 10699,
            "unresolved": 572
          },
          "import_statements": 101281,
          "internal_resolution_rate": 0.582972,
          "resolved_internal": 59044
        }
      },
      "tables": {
        "component_edges": 1571,
        "dependency_edges": 130967,
        "module_nodes": 36412
      }
    },
    "duration_seconds": 171.529,
    "extractor_version": "1.0.0",
    "host": "Rishs-MacBook-Air.local",
    "notes": [],
    "pipeline_version": "1.0.0",
    "platform": "Darwin-arm64",
    "python_version": "3.12.1",
    "repository": "github.com/PostHog/posthog",
    "run_finished_at": "2026-08-17T03:28:23.766476Z",
    "run_id": "334ea4abc63c4726",
    "run_started_at": "2026-08-17T03:25:32.237959Z",
    "schema_version": "1.0.0",
    "stage": "graph",
    "status": "ok",
    "window_end": "2026-08-17T03:25:31.954644Z",
    "window_start": "2026-05-19T00:00:00Z"
  },
  {
    "counters": {
      "coverage": {
        "analyzed_head_sha": "d4295d5794f95a0ae726edd0e27450115f3fc0a3",
        "computed_at": "2026-08-17T03:32:28.215334Z",
        "dependency_graph_version": "1.0.0",
        "files_with_dynamic_imports": 18,
        "graph_nodes": 36412,
        "hub_fan_in_threshold": 15,
        "internal_edges": 141389,
        "not_parsed_files": 1774,
        "not_parsed_languages": [
          "go",
          "hog",
          "rb",
          "rust",
          "sql"
        ],
        "parse_error_examples": [],
        "parse_errors": 0,
        "python": {
          "by_resolution": {
            "exact": 71921,
            "external": 57144,
            "prefix": 2
          },
          "import_statements": 129067,
          "internal_resolution_rate": 0.557253,
          "resolved_internal": 71923
        },
        "tracked_files": 43918,
        "tsconfig_alias_patterns": 61,
        "tsconfig_errors": [],
        "tsconfig_scopes": 15,
        "typescript_javascript": {
          "by_resolution": {
            "alias": 41412,
            "external": 29044,
            "external_alias": 1921,
            "relative": 28054,
            "relative_missing": 278,
            "unresolved": 572
          },
          "import_statements": 101281,
          "internal_resolution_rate": 0.685874,
          "resolved_internal": 69466
        }
      },
      "tables": {
        "component_edges": 1648,
        "dependency_edges": 141389,
        "module_nodes": 36412
      }
    },
    "duration_seconds": 167.716,
    "extractor_version": "1.0.0",
    "host": "Rishs-MacBook-Air.local",
    "notes": [],
    "pipeline_version": "1.0.0",
    "platform": "Darwin-arm64",
    "python_version": "3.12.1",
    "repository": "github.com/PostHog/posthog",
    "run_finished_at": "2026-08-17T03:32:28.216303Z",
    "run_id": "9b586b7e7cfd452c",
    "run_started_at": "2026-08-17T03:29:40.500055Z",
    "schema_version": "1.0.0",
    "stage": "graph",
    "status": "ok",
    "window_end": "2026-08-17T03:29:40.233713Z",
    "window_start": "2026-05-19T00:00:00Z"
  },
  {
    "counters": {
      "actors": {
        "actors": 560,
        "ai_assistant_identities": 7,
        "ambiguous": 242,
        "bots": 34,
        "clusters": 560,
        "git_only": 242,
        "multi_member_clusters": 0,
        "shared_emails": 0,
        "with_login": 318
      },
      "component_coverage": {
        "by_component_source": {
          "convention": 16713,
          "product_directory": 359,
          "product_manifest": 11338,
          "unknown": 134
        },
        "classified_rate": 0.995305,
        "paths": 28544,
        "unknown_component_paths": 134,
        "unknown_component_rate": 0.004695,
        "unowned_paths": 21595,
        "unowned_rate": 0.756551
      },
      "feature_flag_registry_keys": 388,
      "pr_commit_mapping": {
        "mapped_by_github_metadata": 8518,
        "merged_without_local_commit": 164,
        "subject_suffix_conflicts": 0
      },
      "tables": {
        "actors": 560,
        "comments": 0,
        "commit_parents": 15484,
        "commits": 15485,
        "components": 122,
        "extraction_runs": 4,
        "feature_flags": 48,
        "issues": 0,
        "path_map": 28544,
        "pr_files": 77307,
        "pull_requests": 12181,
        "raw_pages": 1503,
        "references": 13785,
        "review_comments": 0,
        "review_threads": 0,
        "reviews": 0
      }
    },
    "duration_seconds": 28.831,
    "extractor_version": "1.0.0",
    "host": "Rishs-MacBook-Air.local",
    "notes": [],
    "pipeline_version": "1.0.0",
    "platform": "Darwin-arm64",
    "python_version": "3.12.1",
    "repository": "github.com/PostHog/posthog",
    "run_finished_at": "2026-08-17T04:11:58.044577Z",
    "run_id": "c366565aa814449f",
    "run_started_at": "2026-08-17T04:11:29.213309Z",
    "schema_version": "1.0.0",
    "stage": "normalize",